{"generated":"2026-10-15","viewBox":[0,0,1000,620],"projection":{"type":"Albers equal-area conic","lon0":105,"lat1":25,"lat2":47,"scale":937.084111,"offx":530.880494,"offy":885.388513},"hubs":{"jingjinji":{"name_en":"Beijing–Tianjin–Hebei hub","name_zh":"京津冀枢纽","cluster":"张家口集群"},"yangtze_delta":{"name_en":"Yangtze River Delta hub","name_zh":"长三角枢纽","cluster":"长三角生态绿色一体化发展示范区集群、芜湖集群"},"greater_bay":{"name_en":"Guangdong–Hong Kong–Macao hub","name_zh":"粤港澳枢纽","cluster":"韶关集群"},"chengdu_chongqing":{"name_en":"Chengdu–Chongqing hub","name_zh":"成渝枢纽","cluster":"天府集群、重庆集群"},"inner_mongolia":{"name_en":"Inner Mongolia hub","name_zh":"内蒙古枢纽","cluster":"和林格尔集群"},"guizhou":{"name_en":"Guizhou hub","name_zh":"贵州枢纽","cluster":"贵安集群"},"gansu":{"name_en":"Gansu hub","name_zh":"甘肃枢纽","cluster":"庆阳集群"},"ningxia":{"name_en":"Ningxia hub","name_zh":"宁夏枢纽","cluster":"中卫集群"}},"sources":{"generation":{"title":"中国统计年鉴 2025, 表 9-19 分地区主要能源产品产量 (发电量, 2024)","publisher":"国家统计局 (NBS)","url":"https://www.stats.gov.cn/sj/ndsj/2025/html/C09-19.jpg","unit":"亿千瓦时 (100 million kWh)","tier":"A","retrieved":"2026-10-12","note":"Full-caliber provincial generation; the table is published as an image and was transcribed by hand."},"consumption":{"title":"中国统计年鉴 2025, 表 9-14 分地区用电量","publisher":"国家统计局 (data from 中国电力企业联合会)","url":"https://www.stats.gov.cn/sj/ndsj/2025/html/C09-14.jpg","unit":"亿千瓦时","tier":"A","retrieved":"2026-10-12"},"water_resources":{"title":"中国统计年鉴 2025, 表 8-8 水资源情况 (2024)","publisher":"国家统计局, from 水利部《中国水资源公报》","url":"https://www.stats.gov.cn/sj/ndsj/2025/html/C08-08.jpg","unit":"亿立方米; 人均 立方米/人","tier":"A","retrieved":"2026-10-12"},"water_use":{"title":"中国统计年鉴 2025, 表 8-9 供水用水情况 (2024)","publisher":"国家统计局, from 水利部《中国水资源公报》","url":"https://www.stats.gov.cn/sj/ndsj/2025/html/C08-09.jpg","unit":"亿立方米; 人均 立方米/人","tier":"A","retrieved":"2026-10-12"},"tariff":{"title":"China's Industrial Power Rates 2025 (1–10 kV general industrial & commercial, non-TOU, as of May 2025)","publisher":"China Briefing (Dezan Shira & Associates), compiled from provincial grid-company price tables","url":"https://www.china-briefing.com/news/chinas-industrial-power-rates-category-electricity-usage-region-classification/","unit":"元/千瓦时 (CNY per kWh)","tier":"C","retrieved":"2026-10-12","note":"Secondary compilation. Jilin, Gansu, Tibet, Hong Kong and Macau are not listed; Inner Mongolia shows the eastern (State Grid) network only. Verify against each province's monthly 代理购电 price notice before citing."},"plants":{"title":"Global Energy Monitor plant trackers (coal, hydro, nuclear, solar, wind, bioenergy), China subset cleaned for the IGARSS workflow","publisher":"Global Energy Monitor (CC BY 4.0)","url":"https://globalenergymonitor.org/","unit":"MW","tier":"C","retrieved":"2026-04-27","note":"Operating units only (status was filtered upstream); a plant with several units appears once per unit at the same point. Gas, oil and waste plants were taken from OpenStreetMap in the IGARSS merge and are excluded here because their capacities are in kW."},"inventory":{"title":"Data-center inventory: commercial directory, baxtel crawl (China subset), DCKB sample, UVA dhi geojsons","publisher":"various","url":null,"unit":"facilities; MW where reported","tier":"C","note":"Published at province level only. Coordinates, addresses and profile links are stripped by the build script and never written to site/data/."}},"provinces":[{"id":"beijing","name":"Beijing","nameZh":"北京","region":"North","hub":"jingjinji","path":"M675.6,248.3L673.2,248.9L671.9,250.4L672.7,251.6L671.3,251.6L669.1,249.7L665.9,249.7L664.1,251.4L662.9,250.0L660.8,249.8L659.4,247.5L661.1,246.6L659.0,244.4L659.2,243.2L663.0,240.3L663.8,240.9L665.1,238.7L662.0,234.5L663.8,232.9L664.8,233.4L666.2,232.7L667.5,229.6L670.1,229.7L668.4,227.1L670.1,227.6L669.7,226.2L671.4,226.0L671.8,224.6L673.1,227.1L676.6,230.0L683.1,230.2L682.4,230.1L682.5,231.3L680.8,231.6L679.7,233.0L682.6,238.1L678.3,241.1L675.6,241.4L675.8,243.5L677.6,244.1L678.1,245.4L677.0,248.1L675.6,248.3Z","cx":670.8,"cy":239.4,"indicators":{"generation_2024":455.64,"hydro_generation_2024":9.44,"consumption_2024":1389.0,"consumption_2020":1140.0,"water_total_2024":52.9,"water_surface_2024":24.5,"water_ground_2024":42.0,"water_per_capita_2024":242.2,"water_use_total_2024":42.1,"water_use_industrial_2024":2.8,"water_use_per_capita_2024":192.7,"tariff_single_1_10kv":0.833,"tariff_two_part_1_10kv":0.65,"water_stress_ratio_2024":0.796,"generation_balance_2024":-933.36,"installed_mw":{"Bioenergy":450.0,"Hydro":892.0,"Solar":51.0,"Wind":49.5},"installed_mw_total":1442.5}},{"id":"tianjin","name":"Tianjin","nameZh":"天津","region":"North","hub":"jingjinji","path":"M682.7,264.5L681.2,263.0L679.6,263.2L677.4,262.1L677.3,258.0L679.0,257.1L679.2,255.9L678.3,255.5L678.3,252.7L677.5,252.7L676.6,248.6L678.3,246.4L678.7,247.5L681.0,247.5L680.6,244.3L681.8,243.7L680.1,242.6L680.4,240.5L683.3,236.8L684.5,236.9L688.2,240.4L685.0,241.0L685.5,244.5L687.2,246.1L686.8,247.3L688.0,248.0L688.6,247.0L690.6,247.0L690.3,250.2L692.1,250.5L693.1,252.7L690.7,253.5L689.2,255.4L690.2,257.2L689.3,257.1L690.1,257.5L689.3,257.5L688.5,259.3L688.1,263.6L684.6,264.8L683.9,263.9L682.7,264.5Z","cx":683.8,"cy":252.5,"indicators":{"generation_2024":879.95,"hydro_generation_2024":0.14,"consumption_2024":1085.0,"consumption_2020":875.0,"water_total_2024":25.2,"water_surface_2024":16.9,"water_ground_2024":9.7,"water_per_capita_2024":184.8,"water_use_total_2024":32.0,"water_use_industrial_2024":4.7,"water_use_per_capita_2024":234.6,"tariff_single_1_10kv":0.8,"tariff_two_part_1_10kv":0.718,"water_stress_ratio_2024":1.27,"generation_balance_2024":-205.05,"installed_mw":{"Bioenergy":359.0,"Coal":12244.0,"Solar":4447.9,"Wind":1488.0},"installed_mw_total":18538.9}},{"id":"hebei","name":"Hebei","nameZh":"河北","region":"North","hub":"jingjinji","path":"M661.6,307.3L659.4,309.9L658.9,308.4L655.1,309.1L652.5,307.6L648.0,307.2L647.2,305.9L644.6,306.4L641.5,304.6L641.4,302.9L639.8,301.6L639.9,300.1L642.3,299.0L642.4,297.4L643.6,297.5L642.9,293.1L644.2,291.4L646.8,283.8L644.9,283.5L645.4,282.3L642.2,276.2L638.4,274.6L638.2,269.8L638.7,268.3L641.4,266.2L640.2,262.8L641.5,261.1L643.4,259.7L644.3,261.0L645.4,261.0L646.3,259.7L647.3,260.2L648.4,258.0L647.8,256.6L649.0,252.3L647.1,250.8L646.5,247.2L644.4,247.4L640.4,245.4L641.3,243.3L642.4,244.2L642.2,242.3L646.6,240.7L647.5,239.1L644.8,239.0L644.1,235.4L637.7,227.5L639.9,225.1L638.6,224.3L638.7,222.7L637.8,221.8L639.6,220.3L642.3,220.2L641.4,215.5L642.7,213.3L644.5,212.4L644.1,211.0L645.0,209.6L647.4,209.8L648.0,208.7L648.7,209.4L648.2,210.6L650.1,214.2L649.3,214.7L649.5,218.1L652.4,217.2L654.1,217.9L655.5,217.1L655.0,215.6L660.4,211.2L661.5,211.0L663.4,213.7L666.3,209.5L667.2,209.5L667.2,210.4L668.3,209.6L669.1,210.4L671.2,210.1L672.8,208.5L672.7,206.9L671.3,205.7L672.9,205.5L672.5,202.0L674.4,200.5L677.8,200.4L678.8,198.1L680.3,198.4L682.4,197.2L685.5,200.6L686.2,202.1L685.3,203.2L687.0,204.1L687.5,206.3L688.5,206.2L688.8,205.2L689.5,206.0L689.5,208.0L690.5,209.1L689.9,210.6L688.5,209.9L688.3,211.1L689.7,213.5L690.8,213.7L690.5,215.3L691.6,215.9L691.8,217.4L696.5,217.0L697.6,216.0L698.4,217.1L702.5,216.3L701.1,220.4L699.5,221.1L700.6,221.9L699.2,222.8L698.9,225.4L701.8,227.4L703.2,226.7L703.1,228.2L704.1,228.0L704.8,229.1L708.4,228.4L709.8,233.4L711.3,233.9L713.0,237.0L709.8,238.8L709.7,240.5L707.8,241.9L706.8,244.8L707.9,247.3L705.0,251.6L701.7,253.0L699.8,252.7L696.8,255.5L692.4,252.9L693.1,252.7L692.1,250.5L690.3,250.2L690.6,247.0L688.6,247.0L688.0,248.0L686.8,247.3L687.2,246.1L685.5,244.5L685.0,240.9L687.8,241.0L688.1,240.3L684.5,236.9L682.1,237.2L679.7,233.0L680.8,231.6L682.5,231.3L682.9,229.7L676.9,230.1L673.1,227.1L671.8,224.6L671.4,226.0L669.7,226.2L670.1,227.6L668.4,227.1L670.1,229.7L667.5,229.6L666.2,232.7L664.8,233.4L663.8,232.9L662.1,234.3L662.4,235.9L665.1,238.7L663.8,240.9L663.0,240.3L659.2,243.3L659.0,244.5L661.1,246.6L659.4,247.5L660.3,247.9L660.3,249.4L662.9,250.0L664.1,251.4L665.9,249.7L669.1,249.7L671.3,251.6L672.7,251.6L671.9,250.4L673.8,248.4L676.7,248.3L677.5,252.7L678.3,252.7L678.2,255.1L679.2,255.9L676.8,259.6L677.8,262.7L681.2,263.0L682.5,264.7L683.9,263.9L684.4,264.8L688.0,263.7L688.1,262.9L690.3,267.2L692.1,268.6L692.7,267.9L692.1,268.7L692.8,269.0L691.0,272.2L689.4,272.6L688.1,276.4L680.1,277.7L676.3,284.2L674.7,282.6L674.2,284.5L673.6,284.5L674.4,285.6L674.0,286.3L670.8,287.1L667.9,296.1L665.4,297.3L663.3,302.0L666.4,307.1L664.7,308.7L663.1,307.0L661.6,307.3ZM677.7,246.1L678.1,245.1L675.8,243.5L675.6,241.4L680.7,239.9L680.1,242.6L681.8,243.7L680.6,244.3L681.0,247.5L678.7,247.5L677.7,246.1Z","cx":668.2,"cy":250.9,"indicators":{"generation_2024":4334.58,"hydro_generation_2024":65.38,"consumption_2024":4987.0,"consumption_2020":3934.0,"water_total_2024":247.9,"water_surface_2024":140.8,"water_ground_2024":179.9,"water_per_capita_2024":335.7,"water_use_total_2024":189.8,"water_use_industrial_2024":16.2,"water_use_per_capita_2024":257.0,"tariff_single_1_10kv":0.673,"tariff_two_part_1_10kv":0.65,"water_stress_ratio_2024":0.766,"generation_balance_2024":-652.42,"installed_mw":{"Bioenergy":1822.5,"Coal":48594.0,"Hydro":5020.0,"Solar":24464.6,"Wind":28360.9},"installed_mw_total":108262.0}},{"id":"shanxi","name":"Shanxi","nameZh":"山西","region":"North","hub":null,"path":"M609.0,335.9L608.7,337.0L606.9,337.2L605.9,338.4L600.9,338.3L600.1,337.0L600.2,332.4L604.0,321.2L601.4,312.4L601.8,305.4L600.2,303.9L601.0,303.0L600.0,302.4L600.4,299.1L599.7,298.3L600.7,298.4L600.2,297.9L603.5,293.7L602.7,291.2L604.0,290.8L604.5,289.1L604.5,287.3L603.2,286.5L603.8,285.7L600.6,282.5L600.3,278.8L601.2,276.7L604.7,273.9L604.6,270.7L606.0,266.8L605.5,265.3L607.2,263.9L608.5,259.7L606.8,258.2L609.6,257.4L610.7,253.7L614.6,254.4L616.6,253.9L617.0,250.7L620.5,243.0L622.3,242.1L625.9,244.0L627.1,243.2L627.5,241.2L629.2,240.4L631.8,239.4L632.8,240.9L635.4,240.3L638.2,237.1L639.2,238.1L641.5,236.6L641.2,233.6L642.0,233.1L644.1,235.4L644.8,239.0L647.5,239.4L646.6,240.7L64